{
  "version": 1,
  "name": "spatial-script-smoke",
  "application": {
    "command": "prototypes/ai-ui-test-tool-auto-probe/target/debug/spatial-demo.exe",
    "window_title": "AI UI Spatial Demo"
  },
  "options": {"stop_on_error": true, "evidence_on_failure": true},
  "steps": [
    {"op": "session.open", "save_session_as": "app"},
    {"op": "inspect_ui", "session": "app", "save_as": "tree"},
    {"op": "get_runtime_health", "session": "app"},
    {"op": "windows_export_evidence", "session": "app"}
  ]
}