{"version":1,"name":"script-self-test","generated_by":"AI","intent":"Validate public Script API against the Makepad demo","application":{"command":"prototypes/ai-ui-test-tool-auto-probe/target/debug/spatial-demo.exe","window_title":"AI UI Spatial Demo"},"options":{"stop_on_error":true,"evidence_on_failure":true},"steps":[{"op":"session.open","save_session_as":"app"},{"op":"inspect_ui","session":"app","save_as":"tree"},{"op":"get_runtime_health","session":"app"}]}