{
  "version": 1,
  "name": "scheduler-e2e-pass-spatial",
  "application": {
    "command": "scheduler-fixture:spatial",
    "window_title": "AI UI Spatial Demo"
  },
  "options": {
    "stop_on_error": true,
    "evidence_on_failure": true,
    "semantic_only": true
  },
  "steps": [
    {
      "op": "session.open",
      "save_session_as": "app"
    },
    {
      "op": "assert_visible",
      "session": "app",
      "id": "window.main"
    },
    {
      "op": "get_runtime_health",
      "session": "app"
    }
  ],
  "teardown": [
    {
      "op": "session.close",
      "session": "app"
    }
  ]
}
